{
  "schema_version": "fitting_manifest.v1",
  "contract_version": "contract.v1",
  "created_at": "2025-02-07T12:00:00Z",
  "inputs_fingerprint": "a1b2c3d4e5f6789012345678901234567890abcd",
  "fingerprint_algo": "sha256",
  "version_keys": {
    "snapshot_version": "UNSPECIFIED",
    "semantic_version": "UNSPECIFIED",
    "geometry_impl_version": "UNSPECIFIED",
    "dataset_version": "UNSPECIFIED"
  },
  "input_manifests": {
    "body_manifest_path": "body_geometry_manifest.json",
    "garment_manifest_path": "garment_geometry_manifest.json"
  },
  "limits": {
    "max_retry": 2,
    "iter_max_per_attempt": 100
  },
  "camera": {
    "camera_preset_id": "fixed_camera_preset_v1",
    "params": {
      "fov_deg": 45,
      "camera_distance_m": 2.0,
      "yaw_deg": 0,
      "pitch_deg": -10,
      "roll_deg": 0,
      "near_m": 0.1,
      "far_m": 10.0,
      "image_resolution_w": 1920,
      "image_resolution_h": 1080
    }
  },
  "outputs": {
    "geometry_manifest_path": "output/geometry_manifest.json",
    "fitting_facts_summary_path": "output/facts_summary.json"
  }
}
